number|merged_at|url|title|Feature|Change Type
4760|2024-07-04 14:37:40+00:00|https://github.com/casper-network/casper-node/pull/4760|Keep minimum/maximum delegation amounts when updating bids|Protocol|Bugfix
4761|2024-06-25 20:23:48+00:00|https://github.com/casper-network/casper-node/pull/4761|Provide more visibility into error codes in binary port|BinaryPort|Enhance
4762|2024-06-25 22:50:13+00:00|https://github.com/casper-network/casper-node/pull/4762|[BUGFIX]: Fix in account hash indirection for addressable entity|AddressableEntity|Bugfix
4764|2024-06-26 16:18:48+00:00|https://github.com/casper-network/casper-node/pull/4764|Derive `Serialize` for some of the types|BinaryPort|Enhance
4765|2024-06-26 13:37:31+00:00|https://github.com/casper-network/casper-node/pull/4765|Minor edits in BINARY_PORT_PROTOCOL.md.|AddressableEntity|Docs
4767|2024-07-23 14:18:07+00:00|https://github.com/casper-network/casper-node/pull/4767|Lower verbosity of a repeated log|Zug|Enhance
4770|2024-07-04 13:49:16+00:00|https://github.com/casper-network/casper-node/pull/4770|Expose delegation rate in reward responses|BinaryPort|Enhance
4775|2024-08-15 16:46:33+00:00|https://github.com/casper-network/casper-node/pull/4775|Precursor for reserved delegator slots|ExEng|Enhance
4781|2024-07-02 14:51:59+00:00|https://github.com/casper-network/casper-node/pull/4781|Rc3 block validator tests fix|Protocol|TestFix
4785|2024-07-04 12:54:36+00:00|https://github.com/casper-network/casper-node/pull/4785|"Fix the ""No such contract"" error"|Runtime|Bugfix
4786|2024-07-18 15:57:53+00:00|https://github.com/casper-network/casper-node/pull/4786|Remove revert on deser in try_get_named_arg introduced in #4569|Runtime|Enhance
4787|2024-07-05 15:45:24+00:00|https://github.com/casper-network/casper-node/pull/4787|Expose protocol version in NodeStatus|BinaryPort|Enhance
4789|2024-07-09 20:26:43+00:00|https://github.com/casper-network/casper-node/pull/4789|Fix a bug in rewards calculation and add a test|Runtime|Bugfix
4795|2024-07-09 18:23:27+00:00|https://github.com/casper-network/casper-node/pull/4795|Drop effects if WASM module execution caused a revert and also add a test for this.|ExEng|Enhance
4796|2024-07-09 17:33:24+00:00|https://github.com/casper-network/casper-node/pull/4796|Add a version information request|BinaryPort|Enhance
4798|2024-07-12 13:56:23+00:00|https://github.com/casper-network/casper-node/pull/4798|Migration version bug fix|Upgrade|Bugfix
4802|2024-07-12 14:56:24+00:00|https://github.com/casper-network/casper-node/pull/4802|Fix unbonding failing if accounts weren't migrated|Upgrade|Bugfix
4805|2024-07-18 12:09:33+00:00|https://github.com/casper-network/casper-node/pull/4805|Fix issue with multiple balance holds in the same block.|Transactions|Bugfix
4809|2024-07-23 15:58:07+00:00|https://github.com/casper-network/casper-node/pull/4809|BUGFIX: Fix miswire of min max delegations amount|Runtime|Bugfix
4810|2024-07-18 13:06:48+00:00|https://github.com/casper-network/casper-node/pull/4810|Bump rust-toolchain to 1.77.2|CI|Cleanup
4814|2024-07-22 14:55:12+00:00|https://github.com/casper-network/casper-node/pull/4814|Reject transactions with gas price tolerance lower than minimum chain threshold|Transactions|Enhance
4815|2024-07-25 14:25:09+00:00|https://github.com/casper-network/casper-node/pull/4815|Bump 'vergen' version to dodge RUSTSEC issues|CI|Cleanup
4816|2024-07-26 13:05:04+00:00|https://github.com/casper-network/casper-node/pull/4816|Return the switch block hash with rewards response|BinaryPort|Enhance
4817|2024-07-26 16:46:47+00:00|https://github.com/casper-network/casper-node/pull/4817|Add an error code for purse not found for balance requests|BinaryPort|Enhance
4822|2024-08-13 22:21:19+00:00|https://github.com/casper-network/casper-node/pull/4822|trie store: fix extension node split when inserting key of variable len|Node|Enhance
4823|2024-09-10 15:51:04+00:00|https://github.com/casper-network/casper-node/pull/4823|Introducing calltable serialization to `TransactionV1` structures subtree.|Transactions|Enhance
4827|2024-08-14 19:26:14+00:00|https://github.com/casper-network/casper-node/pull/4827|Revert keeping zero bids in the auction state|ExEng|Fix
4830|2024-08-17 22:49:23+00:00|https://github.com/casper-network/casper-node/pull/4830|Add gas price to appendable block|Node|Enhance
4831|2024-08-21 00:02:13+00:00|https://github.com/casper-network/casper-node/pull/4831|Consistent carry forward|Upgrade|Enhance
4836|2024-08-30 20:25:31+00:00|https://github.com/casper-network/casper-node/pull/4836|Add batch write operation to trie store|Node|Enhance
4840|2024-08-30 12:40:32+00:00|https://github.com/casper-network/casper-node/pull/4840|Bump transaction limits in the `ttl` test for block validator|Transactions|Testfix
4843|2024-09-05 12:44:34+00:00|https://github.com/casper-network/casper-node/pull/4843|Extend FFI for backwards compatibility|ExEng|Fix
4844|2024-09-10 13:34:32+00:00|https://github.com/casper-network/casper-node/pull/4844|Port the changes related to handling of unbonds in `global-state-update-gen` to `feat-2.0`|1.X|Enhance
4845|2024-09-06 16:38:30+00:00|https://github.com/casper-network/casper-node/pull/4845|Implement Entity and Package information requests (redux)|BinaryPort|Enhance
